{
  "$schema": "https://json-schema.org/draft/2020-12/schema",
  "type": "object",
  "additionalProperties": false,
  "required": ["repository", "version", "revision", "files"],
  "properties": {
    "repository": { "const": "https://github.com/openai/codex" },
    "version": { "type": "string", "pattern": "^[0-9]+\\.[0-9]+\\.[0-9]+$" },
    "revision": { "type": "string", "pattern": "^[a-f0-9]{40}$" },
    "files": {
      "type": "array",
      "minItems": 1,
      "items": {
        "type": "object",
        "additionalProperties": false,
        "required": ["path", "filename", "sha256"],
        "properties": {
          "path": {
            "type": "string",
            "pattern": "^codex-rs/(?:[a-z0-9_-]+/)+[a-z0-9_]+\\.rs$"
          },
          "filename": { "type": "string", "pattern": "^[a-z0-9_]+\\.rs$" },
          "sha256": { "type": "string", "pattern": "^[a-f0-9]{64}$" }
        }
      }
    }
  }
}
